code,question,ans1,pts1,ans2,pts2,ans3,pts3,ans4,pts4,ans5,pts5
W59B,"En vol, le pilote peut anticiper :",l'arrivée d'un mouvement de piqué lorsque sa vitesse diminue,2,l'imminence d'une fermeture du côté où sa commande durcit,-6,l'arrivée prochaine d'une ressource lorsqu'il se sent « tomber vers l'avant »,2,l'arrivée prochaine d'une abattée lorsqu'il se sent « tomber sur le dos »,2,,
W5B,Le meilleur profil d'un terrain de décollage est :,tel que vous pourrez vous éloigner assez vite du relief,2,convexe,2,concave,-6,tel que vous pourrez facilement vous arrêter en cas de problèmes au gonflage,2,,
W60M,"En vol, amortir l'effet pendulaire c'est :",coordonner la vitesse du pilote et de son aile,2,réduire autant que possible la perte de vitesse de l'aile dans les ressources,2,freiner pendant la ressource pour débuter le contre de l'abattée qui va suivre,-6,relever les mains lorsque l'abattée a été contrée,2,,
W61V,"Au cours d'un gonflage dos à l'aile, regard vers l'avant, vous sentez que votre aile vous dévie à droite :",c'est votre demi-aile gauche qui est en train de s'élever en premier,3,c'est votre demi-aile droite qui est en train de s'élever en premier,-6,"vous accélérez en avant et vers la droite puis, l'aile suffisamment haute, lâchez les A et utilisez le frein gauche pour la ramener dans l'axe du décollage",3,"vous accélérez en avant et vers la gauche puis, l'aile suffisamment haute, lâchez les A et utilisez le frein gauche pour la ramener dans l'axe du décollage",-6,,
W62B,Vous gonflez symétriquement dos à l'aile avec un vent de travers droit :,votre demi-aile droite se lève en premier,3,votre demi-aile gauche se lève en premier,-6,pour tenter d'écoper et monter votre aile symétriquement vous vous décalez légèrement sur la droite,3,pour tenter d'écoper et monter votre aile symétriquement vous vous décalez légèrement sur la gauche,-6,,
W63V,"Pendant une course au sol votre aile dévie votre trajectoire sur votre gauche, l'effet pendulaire vous demande :",d'accélérer sur votre gauche pour vous recentrer sous votre aile,3,d'accélérer sur votre droite pour vous recentrer sous votre aile,-6,de contrer avec le frein droit,3,de contrer avec le frein gauche,-6,,
W64B,Une fois que j'ai mis en œuvre les oreilles :,je suis sensible à l'éventuelle diminution du vent dans mes oreilles,2,je surveille mon aile en permanence pour m'assurer que les « oreilles » restent en place,-6,je me donne la possibilité d'étager mon approche lors d'une présentation simultanée de plusieurs ailes à l'atterrissage,2,je peux utiliser l'accélérateur pour descendre encore plus vite,2,,
W65B,Pour faire les oreilles :,je vérifie où aboutissent sur mon aile la sélection des suspentes que je dois tirer,3,je regarde ma voile pour vérifier le bon déroulement de l'opération,3,je n'oublie pas de préalablement me séparer des freins,-6,,,,
W66B,Avec les oreilles :,il est recommandé d'avoir l'accélérateur au pied en cas de phase parachutale,3,mon nouveau taux de chute me permet de facilement redescendre dans toutes les situations aérologiques,-6,je n'ai plus d'autre choix que de piloter les grandes lignes de ma trajectoire à la sellette,3,,,,
W67B,Pour rouvrir les oreilles :,il est recommandé de procéder demi-aile par demi-aile et de valider à chaque étape la présence du vent relatif,2,je libère les suspentes concernées et regarde le bon déroulement de leur réouverture,2,"si la réouverture ne s'est pas faite d'elle-même, j'abaisse, côté fermé, amplement et paisiblement ma commande pour la relâcher aussitôt",2,"si la réouverture ne s'est pas faite d'elle-même, j'applique des actions répétées et rapides de petites amplitudes jusqu'à l'obtention de la réouverture totale",-6,,
W68V,La temporisation :,suit le gonflage et la levée de l'aile et précède la décision de décoller,1,fait l'objet d'un contrôle du tangage,2,vise à synchroniser les vitesses respectives du pilote et de son aile,1,permet de contrôler l'état de son profil,2,,
W69V,La temporisation :,est facilitée par l'absence de vent au décollage,-6,est essentiellement utile pour stabiliser l'aile à la bonne incidence avant la course,3,est d'autant plus facile avec un minimum de vent et de pente,3,"pour les pilotes entraînés, peut se remplacer sans risque par un ressenti de l'appui ventral et des commandes",-6,,
W6M,Le décollage en haute montagne :,est facilité par la densité moindre de l'air,-6,"c'est du paralpinisme, pas du Vol Libre",-6,nécessite un bon niveau d'expérience,6,ne nécessite aucune connaissance particulière d'alpinisme,-6,,
W70V,La décision de décoller sera prise :,pendant la temporisation,-6,juste après la temporisation sur la base de la référence d'un contact avec l'aile aux commandes,3,juste après la temporisation sur la base de la référence d'un appui ventral allant croissant avec la vitesse,3,,,,
W71V,Le gonflage face à la voile :,est une pratique réservée pour le vent fort,-6,demande une temporisation pour caler la bonne incidence de décollage,2,permet d'observer le bon déploiement de l'aile et de ses suspentes,2,permet de contrôler la vitesse et la trajectoire de l'ascension du profil,2,,
W72V,En gonflage face voile :,la prise de commande est différente de celle dos à l'aile,-6,"faisceaux d'élévateurs croisés devant vous, le retournement sera dans le sens qui vous fera passer sous le faisceau supérieur",6,"faisceaux d'élévateurs croisés devant vous, le retournement sera dans le sens qui vous fera passer au-dessus du faisceau supérieur",-6,le prégonflage est possible sans vent,-6,,
W73B,"Par vent soutenu, préalablement à un gonflage face à l'aile :",une traction solidement verrouillée des « C » ou des « D » permet une solution d'attente sûre,3,un pré gonflage ne s'impose pas,-6,j'ai soigneusement trié mes suspentes et disposé mon aile au sol avant d'endosser ma sellette,0," je ne croise pas mes commandes, je les prends en main comme je l'aurais fait en étant dos à l'aile puis réuni les 2 A dans la main du côté de mon sens de rotation",3,,
W74M,Le réglage ou la vérification de la longueur des freins :,ne tient pas compte des modifications de calage créés par l'utilisation de l'accélérateur,-6,s'opère sur pente école,2,doit laisser le bord de fuite sans déformation la poignée de frein étant laissée libre,2,doit être vérifié régulièrement compte tenu de la rétractation potentielles des drisses de freins,2,,
W75B,"En vol, la dureté de mes commandes :",s'accroît avec l'augmentation de la vitesse,2,faiblit avec l'augmentation de la vitesse,-6,augmente lorsque je tire sur les freins,2,dépend de la vitesse relative de chacune de mes demi-ailes,2,,
W76M,Le réglage moyen des freins peut se décrire comme étant :,au plus court du réglage lorsque l'aile est entièrement débridée bras hauts,0,au plus court du réglage lorsque l'aile est légèrement bridée bras hauts,-6,correct lorsque l'aile est faiblement bridée les mains aux alentours des oreilles,3,avec une garde minimum qui garantit une utilisation de l'accélérateur sans que l'aile ne soit bridée « bras hauts »,3,,
W77V,Si je relève rapidement mes mains pour reprendre de la vitesse le risque est :,"au décollage, pendant la course au sol, de perdre le soutien de l'aile car elle va me doubler",2,"en vol, d'obtenir une abattée non désirée",2,"à l'atterrissage, de voir le sol se rapprocher brutalement",2,d'entrer en phase parachutage,-6,,
W78M,La mise en virage d'une aile débute :,parfois avec une diminution de la vitesse de vol suivie de son augmentation,2,parfois avec un mouvement de roulis inverse,2,parfois avec une résistance pouvant déséquilibrer le pilote à l'opposé de la direction convoitée,2,,,,
W79B,Suite à une turbulence ou à une entrée de thermique mon aile cabre :,mon aile est en train de perdre de la vitesse,2,je ressens une bascule arrière,2,je réagis en relevant brièvement mes mains puis les rabaisse si une abattée s'enchaîne,2,je réagis en bridant doucement mon aile,-6,,
W7V,Le décollage par vent nul :,est dangereux,-6,oblige à courir au moins à la vitesse minimum de vol de l'aile,6,nécessite un enfoncement important des commandes,-6,,,,
W80M,Les symptômes de l'imminence d'une vrille sont :,une augmentation brutale de la vitesse,-6,un silence préjugeant d'une très basse vitesse,2,le sentiment d'une aile sollicitée à tourner qui tourne mal,2,une commande dure et profondément abaissée du côté sollicité,2,,
W81B,En vol une turbulence ferme brutalement mon aile ; je me sens tomber à droite dans ma sellette :,je résiste au déséquilibre en transférant mon poids à gauche,2,j'utilise mon frein gauche de manière à ralentir un départ en rotation,2,je regarde mon aile pour évaluer la situation et son évolution,2,j'actionne immédiatement ma main droite avec un geste ample et profond pour forcer la réouverture de l'aile,-6,,
W82B,A l'atterrissage une prise de vitesse est nécessaire en finale car :,en présence de vent le risque d'un gradient est propre à soudainement réduire ma vitesse relative,3,"les forces aérodynamiques augmentant au carré de la vitesse, elles favoriseront un freinage efficace",3,les forces aérodynamiques n'ont pas une incidence directe sur la vitesse de vol,-6,,,,
W83M,"Vous volez sous du matériel classé B de la norme CEN, à jour de révision :","vous êtes protégé des incidents de vol irréversibles (twist, cravate, etc.)",-6,la norme CEN atteste d'une résistance initiale de votre aile à au moins 8G,3,le contrôle de votre aile vous informe de son niveau d'usure,3,la révision du calage de votre aile est une option pour les puristes,-6,,
W84M,"Vous volez en aérologie très turbulente, vous êtes déséquilibré et tombez d'un côté de la sellette :",vous tirez immédiatement le secours,-6,vous tirez violemment et au maximum du débattement le frein opposé,-6,vous jetez un regard vers la voile pour évaluer l'ampleur de la fermeture,3,vous contrez à la sellette et au frein pour tempérer le départ en rotation de l'aile,3,,
W85B,"Votre secours est ouvert, vous sentez la traction liée à son déploiement :",vous tirez sur un frein pour ramener la voile,-6,vous faite symétriquement des tours de frein en dosant leur nombre pour stabiliser l'ensemble,2,vous regardez vers le bas pour estimer le lieu de l'atterrissage,2,vous vous redressez et vous préparez à amortir le choc,2,,
W86M,Un grand débattement aux commandes :,diminue le risque de surpilotage,6,caractérise uniquement les voiles de débutants,-6,est synonyme de grande plage de vitesse,-6,,,,
W87M,Une diminution brutale d'incidence :,rapproche de la fermeture frontale,3,éloigne de la fermeture frontale,-6,ne demande jamais d'actions de pilotage grâce à la stabilité pendulaire,-6,peut être compensée par une traction momentanée des commandes,3,,
W88M,Le constructeur préconise un réglage de la ventrale du harnais; en la desserrant :,j'augmente le risque d'autorotation en cas de fermeture,3,je ressens mieux les mouvements aérologiques,3,j'augmente les risques de twist en cas de fermeture,-6,,,,
W89M,Le constructeur préconise un réglage de la ventrale du harnais; en la serrant davantage :,j'augmente le risque d'autorotation si je reste passif en cas de fermeture,-6,je ressens mieux les mouvements aérologiques,-6,j'augmente le risque de twist en cas de fermeture,6,,,,
W8B,"Au décollage, il y a 30 km/h de vent ; mon aile vole à une vitesse maximale de 35 km/h :",vous devez courir à 5 km/h pour décoller,-6,vous vous abstenez de décoller en estimant que la marge de sécurité n'est pas suffisante,6,vous utilisez l'accélérateur dés que possible pour pouvoir vous éloigner du relief,-6,,,,
W90M,"J'inscris ma voile en spirale (360°), puis je relâche les commandes :",la voile reste en virage : elle est neutre spirale,2,la voile revient en vol droit : elle est neutre spirale,-6,la voile revient en vol droit : elle est stable spirale,2,la voile « engage » : elle est instable spirale,2,,
W91M,"J'inscris ma voile en spirale (360°), puis je relâche les commandes :",la voile reste en virage : elle est stable spirale,-6,la voile revient en vol droit : elle est neutre spirale,-6,la voile « engage » : elle est instable spirale,6,,,,
W92M,"J'inscris ma voile en spirale (360°), puis je relâche les commandes :",la voile reste en virage : elle est neutre spirale,6,la voile revient en vol droit : elle est instable spirale,-6,la voile « engage » : elle est stable spirale,-6,,,,
W93M,"J'inscris ma voile en spirale (360°), puis je relâche les commandes ; l'aile continue à accélérer :",l'aile est instable spirale,2,l'aile est neutre spirale,-6,pour sortir de la rotation j'utilise la commande extérieure,2,pour dissiper ma vitesse et tempérer ma ressource j'utilise la commande extérieure puis l'intérieure dès qu'apparaît la ressource,2,,
W94M,"En cas d'incident de vol avec départ en autorotation, vous jugez nécessaire de jeter le secours :",immédiatement,0,après un demi-tour contré sans résultat,3,"vous êtes à 200 m/sol, vous avez tout le temps pour tenter de contrer l'autorotation",-6,vous avez fait une erreur de pilotage pour en arriver là,3,,
W95B,"Vous venez d'acquérir une nouvelle aile, afin de mieux la connaître et comme vous avez un parachute de secours :",vous recherchez la phase parachutale,-6,vous multipliez les vols dans des aérologies standards pour vous la rendre familière,3,"après un peu de gain, vous réalisez quelques « 360° » engagés afin de mesurer le taux de chute maximal",-6,vous effectuez éventuellement une journée de stage en milieu aménagé,3,,
W9B,"Au décollage, avec 20 km/h de face, vous pouvez gonfler votre voile :",face-voile en vous attendant à devoir avancer vers l'aile pour contrôler sa vitesse d'ascension,3,face-voile en réunissant les deux élévateurs A dans la main du côté de votre sens de rotation et en utilisant l'autre main pour contrôler la trajectoire de l'ascension de l'aile,3,dos à l'aile en vous attendant à devoir fortement résister en reculant pour contrôler la vitesse d'ascension du profil,-6,face-voile en prenant un élévateur A dans chaque main en vous attendant à devoir les tractionner pour contrecarrer la force du vent,-6,,
X10V,Le décollage en delta :,"est irréversible, impossibilité de s'arrêter",2,n'est pas facilité par l'effet de sol,-6,nécessite une mise en mouvement progressive,2,nécessite une rotation des mains pendant la montée de l'aile pour empêcher un verrouillage au niveau des coudes,2,,
X11B,"Par vent nul sur une pente faible, pour décoller :",vous courez le plus longtemps possible en pilotant l'aile sans faire varier brutalement l'incidence,6,vous courez à fond en tirant sur la barre de contrôle,-6,vous courez à fond en poussant franchement la barre de contrôle pour décoller plus vite,-6,,,,
X12B,"35 km/h de vent de face au décollage, vous êtes seul :","vous êtes un pilote moyen, c'est trop vous vous abstenez",6,un pilote très expérimenté peut décoller sans problèmes si le vent est laminaire,0,vous essayez de décoller car ou vous n'y arriverez pas ou ça partira tout seul sans avoir besoin de courir,-6,,,,
X13V,"Après le décollage, vous :",attrapez la barre des pieds ou fermez l'intégral en priorité,-6,stabilisez votre aile au régime de croisière,3,vous occupez de votre trajectoire et de la position des autres ailes,3,,,,
X14V,"En vol stabilisé, vous tirez sur la barre de contrôle :",le vent sur le visage augmente,3,l'incidence augmente,-6,le vent sur le visage diminue,-6,l'incidence diminue,3,,
X15V,"En vol sur une aile bien réglée, si vous lâchez la barre de contrôle :",l'aile ralentit progressivement jusqu'au décrochage,-6,l'aile accélère jusqu'a la vitesse maximale,-6,l'aile reste à une vitesse du régime de croisière,6,il ne faut jamais la lâcher,-6,,
X16B,"En vol, barre de contrôle lâchée, votre aile vire anormalement à droite :",vous rejoignez directement l'atterrissage,2,"au sol, vous contrôlez la géométrie de votre aile",2,"au sol, vous contrôlez les bords d'attaque",2,,,,
X17V,"Pour une mise en virage, il faut :","tirer, déporter le poids latéralement, vérifier que la voie est libre",-6,"tirer, vérifier que la voie est libre, déporter le poids latéralement",-6,"vérifier que la voie est libre, tirer, déporter le poids latéralement",6,,,,
X18B,Une mise en virage à 360° :,est à proscrire en prise de terrain,2,peut être vigoureuse car le risque de décrochage est nul,-6,nécessite une prise de vitesse préalable,2,se fait d'autant plus inclinée que l'ascendance est étroite,2,,
X19V,Vous risquez la mise en vrille :,en commençant un virage à vitesse lente,4,en commençant un virage avec une bonne réserve de vitesse,-6,ce risque est variable suivant le type de l'aile,2,,,,
X1V,En pente école :,vous utilisez au début des ailes spécifiques non utilisables en grand vol et rendant l'apprentissage plus facile,3,vous utilisez les ailes des années 70 beaucoup plus sures à ce niveau,-6,le casque est utile même pour des exercices « non accroché » sous l'aile,3,,,,
X20B,"Vous êtes à 400 m/sol avec une aile réglée, conditions calmes, vous augmentez progressivement l'incidence et vous provoquez un décrochage :",vous tirez fort au moment de l'abattée pour favoriser la reprise de vitesse puis vous repoussez progressivement pour limiter la survitesse,-6,vous continuez à pousser pour retarder le moment de l'abattée le plus longtemps possible,-6,vous accompagnez l'abattée puis vous amortissez la ressource,6,,,,
X21B,La sortie d'un décrochage s'effectue en général :,en accompagnant la barre de contrôle vers l'arrière car l'appareil veut piquer,3,en retenant la barre de contrôle car l'appareil veut cabrer,-6,a une vitesse plus élevée que le régime de vol finesse/maximum,-6,a une vitesse moins élevée que le régime de vol finesse/maximum,3,,
X22B,Le décrochage dynamique est caractérisé par :,une prise de vitesse initiale,3,une abattée brutale,3,de violentes vibrations dans la barre de contrôle,-6,"un fort taux de chute, une sensation d'enfoncement et des vibrations éventuelles de l'appareil",-6,,
X23M,Vous allez entrer dans une ascendance :,vous vous préparez à pousser,-6,vous conservez le même régime de vol,0,vous vous préparez à tirer légèrement,6,,,,
X24M,"Pour sortir d'une situation d'auto rotation, il faut :","pousser la barre de contrôle au maximum, le corps bien centré",-6,maintenir la vitesse et décentrer le corps au maximum pour redresser l'aile avant qu'il ne soit trop tard,-6,tirer la barre pour réduire l'incidence puis déporter le corps vers l'extérieur comme pour un virage,6,monter dans le trapèze et faire corps avec la machine dans l'adversité,-6,,
X25B,Avant l'atterrissage vous ouvrez votre harnais intégral :,avant la prise de terrain,6,au début de la finale,-6,en fin de finale,-6,,,,
X26M,"Vous êtes contraint de vous poser dans un terrain en pente, vous vous posez :",en travers,-6,à contre-pente,6,dans le sens de la descente,-6,,,,
X27B,"Vous vous préparez à atterrir avec un vent au sol assez fort, environ 20 km/h :",vous accélérez fortement en finale et vous vous préparez à pousser fort,-6,vous maintenez votre vitesse et vous vous préparez à vous poser en douceur sans arrondir,-6,vous accélérez légèrement et vous vous posez en poussant modérément,6,vous restez couché le plus longtemps possible afin de pouvoir piloter et pousser plus facilement en vous relevant,-6,,
X28B,"Vous êtes à quelques mètres du sol, vous vous mettez involontairement en situation de décrochage, il est préférable de :",secouer l'aile pour essayer de parachuter sans décrocher,-6,tirer pour repartir vers l'avant,-6,pousser pour essayer de parachuter et réduire l'abattée,-6,"arrêter de pousser, laisser l'aile s'enfoncer et repousser à fond lorsque le sol approche",6,,
X29B,"Classez les actions suivantes, juste après le décollage : (1 = s'assurer d'être sur une bonne trajectoire à bonne vitesse) (2 = s'installer dans le harnais) (3 = rechercher l'ascendance) :","2, 1, 3",-6,"1, 3, 2",6,"3, 2, 1",-6,,,,
X2V,Une aile neuve doit être essayée :,par le fabriquant ou le revendeur,3,par l'acheteur qui a le « devoir » de l'inaugurer,-6,"a défaut du professionnel concerné, par un pilote habitué une machine de même niveau",3,,,,
X30B,A quel moment doit on ouvrir le drag chute :,"en fin de finale, s'il y a du vent pour être sûr de « rentrer »",-6,lors de son approche et avant l'étape de base,6,en finale si nécessaire,-6,,,,
X31B,"Mon drag chute est ouvert, je suis en finale :","j'ai l'impression d'être un peu long, je peux par une action de pilotage raccourcir ma distance de posé",6,"j'ai l'impression d'être un peu court, je peux par une action de pilotage allonger ma distance de posé",-6,je tire plus que sans drag chute pour ne pas décrocher,-6,,,,
X32B,Le drag chute :,est indispensable dès que l'on a un doute sur sa capacité à atterrir en sécurité : suffisamment loin des bords du terrain d'atterrissage,4,ne s'utilise qu'en cas de besoin,-6,"s'utilise en cas de besoin, mais de toute façon assez périodiquement pour être habitué à l'utiliser",2,un bon pilote n'en a pas besoin,-6,,
X33B,L'intérêt du drag chute est de :,pouvoir modifier beaucoup la vitesse-sol en finale,-6,pouvoir modifier beaucoup la finesse-sol en finale,6,freiner l'aile pour atterrir en douceur,-6,,,,
X34B,Je garde le drag chute à la main en finale :,"si j'ai besoin de l'ouvrir, je cours le risque d'une ouverture mauvaise ou tout simplement lente",3,je cours le risque de le laisser échapper devant le trapèze ou les câbles latéraux,3,c'est la meilleure manière d'être précis,-6,,,,
X35B,Avant l'atterrissage après un très long vol :,je me redresse très tôt dans le harnais et remue les jambes qui sont ankylosées,2,j'envisage le posé sur les roulettes avec le drag chute si je me sent très fatigué,2,je ne change pas mes habitudes c'est le meilleur moyen de faire des conneries,-6,"je sais que la fatigue diminue la lucidité, je me concentre pour faire du « classique propre »",2,,
X36B,La prise de vitesse avant l'atterrissage :,est nécessaire pour garder une bonne vitesse/air car un gradient de vent est possible à l'approche du sol,2,n'est pas indispensable en delta,-6,permet un palier avant l'atterrissage,2,augmente ma maniabilité en cas de turbulences,2,,
X37V,"En finale avant l'atterrissage, vous prenez de la vitesse pour :",traverser la zone de gradient près du sol qui diminue votre vitesse-air,2,augmenter la longueur de votre palier et faciliter le choix du moment du poussé final,2,réduire rapidement votre hauteur-sol et vous trouver en sécurité,-6,garder de la maniabilité en cas de turbulences,2,,
X3B,"Classez les actions suivantes, nécessaires pour ouvrir le parachute : ( 1= tirer sur la poignée ) ( 2= jeter la voile ) ( 3= visualiser un espace libre ) ( 4= monter dans le trapèze ) ( 5= surveiller l'ouverture ) :",1 - 2 - 3 - 4 - 5,-6,3 - 1 - 4 - 2 - 5,-6,4 - 1 - 3 - 2 - 5,-6,1 - 3 - 2 - 5 - 4,6,,
X4B,"En cas d'utilisation du parachute de secours, il faut après l'ouverture :",se pendre après la sangle du parachute,-6,se mettre en boule pour se protéger du choc,-6,garder si possible la barre de contrôle poussée à fond,-6,saisir les montants de trapèze et mettre les pieds sur la barre de contrôle,6,,
X5V,L'effet de sol a comme conséquence :,d'allonger les distances de décollage et d'atterrissage,-6,de raccourcir ces deux distances,-6,d'allonger la distance d'atterrissage et de raccourcir celle de décollage,6,,,,
X6V,"Pour votre sécurité, vous devez faire un essai d'accrochage :",avant chaque décollage,3,sur la zone de montage après la prévol,0,sur la zone de décollage juste avant le décollage,3,,,,
X7V,Un essai d'accrochage juste avant le décollage est nécessaire :,pour ne pas oublier de s'accrocher,2,pour être sur du bon placement des sangles de réglage,2,pour vérifier le passage du harnais au-dessus de la barre de contrôle et éventuellement des instruments,2,,,,
X8V,Le meilleur profil d'un terrain de décollage est tel que vous pourrez :,vous éloignez assez vite du relief,3,facilement courir dans la pente pour atteindre la vitesse de vol,3,longer le relief longtemps pour prendre de la vitesse,-6,,,,
X9B,"Pour une même assiette, le décollage sur une pente forte engendrera par rapport au décollage sur une pente faible, une incidence :",plus forte,6,moins forte,-6,égale,-6,variable selon le vent,-6,,
X27M,La formation fédérale au monitorat de delta :,commence après l'obtention de l'accompagnateur et de l'animateur de club,2,"comprend un stage de formation, un stage en situation et un examen final",4,peut commencer dès l'obtention du brevet de pilote confirmé,-6,est réservée aux futurs moniteurs brevetés d'Etat ou brevets professionnels,-6,,
S10T,Le dossier Tracté est un document qui décrit :,les accidents liés à la pratique du Tracté en France,-6,les bonnes pratiques du Tracté en France,3,la réglementation liée à la pratique du Tracté en France,1,des questions d'assurances de la pratique du Tracté en France,2,,
S11T,Le dossier Tracté est un document qui :,décrit les cursus des formations fédérales,2,décrit les types de treuil et les obligations d'organes de sécurité,2,donne des éléments de théorie du treuil,2,n'a aucune valeur légale,-6,,
S12T,Le dossier Tracté :,n'est pas utile dans la pratique du Tracté au quotidien,-3,est réservé aux treuilleurs et ne doit pas être mis à disposition des pilotes,-3,est validé par le comité directeur de la FFVL,3,est un document écrit par les membres de la commission Tracté,3,,
